{
 "$schema": "https://json-schema.org/draft/2020-12/schema",
 "$id": "urn:amiss:schema:scanner-policy",
 "title": "Amiss repository scanner policy",
 "description": "The rolling raise-only repository policy read from exactly .amiss/scanner-policy.json.",
 "type": "object",
 "additionalProperties": false,
 "required": [
  "schema",
  "document_includes",
  "protected_inventory",
  "finding_dispositions"
 ],
 "properties": {
  "schema": {
   "const": "amiss/scanner-policy"
  },
  "document_includes": {
   "type": "array",
   "maxItems": 100000,
   "description": "Exact repository paths only. Sort by path UTF-8 bytes, then kind; that pair is the stable selector identity. A tree entry may narrow itself to one exact suffix and may bind one built-in adapter.",
   "x-amiss-order": [
    "path",
    "kind"
   ],
   "uniqueItems": true,
   "items": {
    "$ref": "#/$defs/DocumentInclude"
   }
  },
  "projection_assertions": {
   "type": "array",
   "maxItems": 100000,
   "description": "Policy-owned source-to-document relations. Sort by document UTF-8 bytes, then name; that pair is the stable assertion identity.",
   "x-amiss-order": [
    "document",
    "name"
   ],
   "uniqueItems": true,
   "items": {
    "$ref": "#/$defs/ProjectionAssertion"
   }
  },
  "protected_inventory": {
   "type": "array",
   "maxItems": 100000,
   "description": "Exact document paths only. Sort by RepoPath UTF-8 bytes.",
   "x-amiss-order": [
    "RepoPath"
   ],
   "uniqueItems": true,
   "items": {
    "$ref": "#/$defs/RepoPath"
   }
  },
  "finding_dispositions": {
   "type": "array",
   "maxItems": 3,
   "description": "Raise-only overrides. Sort by finding_kind UTF-8 bytes.",
   "x-amiss-order": [
    "finding_kind"
   ],
   "uniqueItems": true,
   "items": {
    "$ref": "#/$defs/FindingDisposition"
   }
  },
  "default_branch_aliases": {
   "type": "array",
   "maxItems": 16,
   "description": "Old names of the default branch, read as the default branch in same-repository URLs. Sort by UTF-8 bytes.",
   "x-amiss-order": [
    "BranchRef"
   ],
   "uniqueItems": true,
   "items": {
    "$ref": "#/$defs/BranchRef"
   }
  },
  "anchor_renderers": {
   "type": "array",
   "minItems": 1,
   "maxItems": 16,
   "description": "Raise-only pin: the heading renderers whose identities a Markdown or MDX page publishes, named as the engine's anchor rules. Sort by UTF-8 bytes.",
   "x-amiss-order": [
    "RendererName"
   ],
   "uniqueItems": true,
   "items": {
    "$ref": "#/$defs/RendererName"
   }
  },
  "translations": {
   "type": "array",
   "maxItems": 64,
   "description": "Translated trees beside their sources; a page under source is translated at the same path under target. Sort by source, then target, UTF-8 bytes.",
   "x-amiss-order": [
    "source",
    "target"
   ],
   "uniqueItems": true,
   "items": {
    "$ref": "#/$defs/TranslationPair"
   }
  }
 },
 "$defs": {
  "RendererName": {
   "type": "string",
   "minLength": 1,
   "maxLength": 64,
   "pattern": "^[a-z][a-z0-9-]*$"
  },
  "BranchRef": {
   "type": "string",
   "minLength": 12,
   "maxLength": 266,
   "pattern": "^refs/heads/(?!/)(?![\\s\\S]*\\.\\.)(?![\\s\\S]*@\\{)(?![\\s\\S]*[~^:?*\\[\\\\\\u0000-\\u001f\\u007f ])(?!\\.)(?![\\s\\S]*/\\.)(?![^/]*\\.lock(?:/|$))(?![\\s\\S]*/[^/]*\\.lock(?:/|$))(?![\\s\\S]*//)(?![\\s\\S]*/$)(?![\\s\\S]*\\.$).+$"
  },
  "RepoPath": {
   "type": "string",
   "minLength": 1,
   "maxLength": 4096,
   "pattern": "^(?!/)(?![\\s\\S]*//)(?![\\s\\S]*(?:^|/)(?:\\.{1,2})(?:/|$))(?![\\s\\S]*[\\\\\\u0000])[^/]+(?:/[^/]+)*$",
   "description": "Strict UTF-8 repository-relative path using slash separators; byte limits and UTF-8 validity are additionally enforced before JSON decoding."
  },
  "DocumentInclude": {
   "type": "object",
   "additionalProperties": false,
   "required": [
    "path",
    "kind"
   ],
   "properties": {
    "path": {
     "$ref": "#/$defs/RepoPath"
    },
    "kind": {
     "enum": [
      "document",
      "tree"
     ]
    },
    "suffix": {
     "$ref": "#/$defs/ExactSuffix"
    },
    "adapter": {
     "enum": [
      "asciidoc",
      "markdown",
      "mdx",
      "plain-advisory",
      "rst"
     ],
     "description": "Reads the included path under this built-in grammar. Only paths outside the built-in classification rows take a binding; the effective map is the candidate side's policy, or the base side's when the candidate carries none."
    }
   },
   "allOf": [
    {
     "if": {
      "required": [
       "suffix"
      ]
     },
     "then": {
      "properties": {
       "kind": {
        "const": "tree"
       }
      }
     }
    }
   ]
  },
  "ExactSuffix": {
   "type": "string",
   "minLength": 2,
   "maxLength": 64,
   "pattern": "^\\.[^/\\\\\\u0000]+$",
   "description": "Optional exact UTF-8 suffix for a tree selector. The Rust reader additionally caps its UTF-8 encoding at 64 bytes. No glob, wildcard, regex, normalization, or case folding is applied."
  },
  "PositiveSafeUInt": {
   "type": "integer",
   "minimum": 1,
   "maximum": 9007199254740991
  },
  "RecordSetName": {
   "type": "string",
   "minLength": 1,
   "maxLength": 128,
   "pattern": "^[a-z0-9][a-z0-9._/-]*$"
  },
  "RecordKey": {
   "type": "string",
   "minLength": 1,
   "maxLength": 4096,
   "pattern": "^[^\\u0000-\\u001f\\u007f-\\u009f]+$"
  },
  "BlobLineSelection": {
   "type": "object",
   "additionalProperties": false,
   "required": [
    "kind",
    "path",
    "first_line",
    "last_line"
   ],
   "properties": {
    "kind": {
     "const": "blob-lines"
    },
    "path": {
     "$ref": "#/$defs/RepoPath"
    },
    "first_line": {
     "$ref": "#/$defs/PositiveSafeUInt"
    },
    "last_line": {
     "$ref": "#/$defs/PositiveSafeUInt"
    }
   }
  },
  "SourceMarker": {
   "type": "string",
   "minLength": 1,
   "maxLength": 256,
   "pattern": "^[ -~]*[!-~][ -~]*$"
  },
  "NamedRegionSelection": {
   "type": "object",
   "additionalProperties": false,
   "required": [
    "kind",
    "path",
    "start_marker",
    "end_marker"
   ],
   "properties": {
    "kind": {
     "const": "named-region"
    },
    "path": {
     "$ref": "#/$defs/RepoPath"
    },
    "start_marker": {
     "$ref": "#/$defs/SourceMarker"
    },
    "end_marker": {
     "$ref": "#/$defs/SourceMarker"
    }
   }
  },
  "TreePathSelection": {
   "type": "object",
   "additionalProperties": false,
   "required": [
    "kind",
    "root",
    "maximum_depth"
   ],
   "properties": {
    "kind": {
     "const": "tree-paths"
    },
    "root": {
     "$ref": "#/$defs/RepoPath"
    },
    "suffix": {
     "$ref": "#/$defs/ExactSuffix"
    },
    "maximum_depth": {
     "$ref": "#/$defs/PositiveSafeUInt"
    }
   }
  },
  "RecordValueSelection": {
   "type": "object",
   "additionalProperties": false,
   "required": [
    "kind",
    "set",
    "key"
   ],
   "properties": {
    "kind": {
     "const": "record-value"
    },
    "set": {
     "$ref": "#/$defs/RecordSetName"
    },
    "key": {
     "$ref": "#/$defs/RecordKey"
    }
   }
  },
  "RecordSetSelection": {
   "type": "object",
   "additionalProperties": false,
   "required": [
    "kind",
    "set"
   ],
   "properties": {
    "kind": {
     "const": "record-set"
    },
    "set": {
     "$ref": "#/$defs/RecordSetName"
    }
   }
  },
  "BlobSelection": {
   "type": "object",
   "additionalProperties": false,
   "required": [
    "kind",
    "path"
   ],
   "properties": {
    "kind": {
     "const": "blob"
    },
    "path": {
     "$ref": "#/$defs/RepoPath"
    }
   }
  },
  "KeyValueSelection": {
   "type": "object",
   "additionalProperties": false,
   "required": [
    "kind",
    "path",
    "format",
    "key"
   ],
   "properties": {
    "kind": {
     "const": "key-value"
    },
    "path": {
     "$ref": "#/$defs/RepoPath"
    },
    "format": {
     "enum": [
      "toml",
      "json"
     ]
    },
    "key": {
     "type": "array",
     "minItems": 1,
     "maxItems": 16,
     "description": "The table or object keys from the root to one scalar, in order.",
     "items": {
      "type": "string",
      "minLength": 1,
      "maxLength": 256,
      "pattern": "^[^\\u0000-\\u001f\\u007f-\\u009f]+$"
     }
    }
   }
  },
  "CodeTextSource": {
   "oneOf": [
    {
     "$ref": "#/$defs/BlobLineSelection"
    },
    {
     "$ref": "#/$defs/NamedRegionSelection"
    },
    {
     "$ref": "#/$defs/RecordValueSelection"
    },
    {
     "$ref": "#/$defs/BlobSelection"
    },
    {
     "$ref": "#/$defs/KeyValueSelection"
    }
   ]
  },
  "ProjectionSource": {
   "oneOf": [
    {
     "$ref": "#/$defs/BlobLineSelection"
    },
    {
     "$ref": "#/$defs/NamedRegionSelection"
    },
    {
     "$ref": "#/$defs/TreePathSelection"
    },
    {
     "$ref": "#/$defs/RecordValueSelection"
    },
    {
     "$ref": "#/$defs/RecordSetSelection"
    },
    {
     "$ref": "#/$defs/BlobSelection"
    },
    {
     "$ref": "#/$defs/KeyValueSelection"
    }
   ]
  },
  "InventorySource": {
   "oneOf": [
    {
     "$ref": "#/$defs/TreePathSelection"
    },
    {
     "$ref": "#/$defs/RecordSetSelection"
    }
   ]
  },
  "ProjectionAssertion": {
   "type": "object",
   "additionalProperties": false,
   "required": [
    "document",
    "name",
    "projection",
    "sink",
    "source"
   ],
   "properties": {
    "document": {
     "$ref": "#/$defs/RepoPath"
    },
    "name": {
     "type": "string",
     "minLength": 1,
     "maxLength": 120,
     "pattern": "^[A-Za-z0-9][A-Za-z0-9._-]*$"
    },
    "projection": {
     "enum": [
      "code-text-v1",
      "sorted-rows-v1",
      "decimal-count-v1",
      "contains-v1"
     ]
    },
    "sink": {
     "const": "previous-code"
    },
    "source": {
     "$ref": "#/$defs/ProjectionSource"
    }
   },
   "allOf": [
    {
     "if": {
      "properties": {
       "projection": {
        "enum": [
         "code-text-v1",
         "contains-v1"
        ]
       }
      }
     },
     "then": {
      "properties": {
       "source": {
        "$ref": "#/$defs/CodeTextSource"
       }
      }
     }
    },
    {
     "if": {
      "properties": {
       "projection": {
        "enum": [
         "sorted-rows-v1",
         "decimal-count-v1"
        ]
       }
      }
     },
     "then": {
      "properties": {
       "source": {
        "$ref": "#/$defs/InventorySource"
       }
      }
     }
    }
   ]
  },
  "FindingKind": {
   "enum": [
    "explicit-target-missing",
    "explicit-target-type-mismatch",
    "invalid-reference"
   ]
  },
  "FindingDisposition": {
   "type": "object",
   "additionalProperties": false,
   "required": [
    "finding_kind",
    "disposition"
   ],
   "properties": {
    "finding_kind": {
     "$ref": "#/$defs/FindingKind"
    },
    "disposition": {
     "enum": [
      "warn",
      "fail"
     ]
    }
   }
  },
  "TranslationPair": {
   "type": "object",
   "additionalProperties": false,
   "required": [
    "source",
    "target"
   ],
   "properties": {
    "source": {
     "$ref": "#/$defs/RepoPath"
    },
    "target": {
     "$ref": "#/$defs/RepoPath"
    }
   }
  }
 }
}
